{
  "protocol_version": "codeattest.v0",
  "submission_outcome_id": "submission_outcome:synthetic-demo-0003",
  "review_id": "review:synthetic-demo-001",
  "outcome_state": "received_with_receipt",
  "bundle_instance_id": "bundle_instance:synthetic-demo-0003",
  "submission_attempt_id": "submission_attempt:synthetic-demo-0003",
  "occurred_at": "2026-07-20T00:00:00Z",
  "submission_identities": [
    {
      "identity_type": "manifest_id",
      "identity_value": "sha256:1a1a1a1a1a1a1a1a1a1a1a1a1a1a1a1a1a1a1a1a1a1a1a1a1a1a1a1a1a1a1a1a"
    },
    {
      "identity_type": "evidence_bundle_id",
      "identity_value": "sha256:2b2b2b2b2b2b2b2b2b2b2b2b2b2b2b2b2b2b2b2b2b2b2b2b2b2b2b2b2b2b2b2b"
    },
    {
      "identity_type": "bundle_instance_id",
      "identity_value": "bundle_instance:synthetic-demo-0003"
    },
    {
      "identity_type": "submission_attempt_id",
      "identity_value": "submission_attempt:synthetic-demo-0003"
    }
  ],
  "next_path": "verify_receipt",
  "customer_facing_summary": "CodeAttest recorded a Vendor Receipt for this submission.",
  "vendor_receipt_ref": "sha256:3c3c3c3c3c3c3c3c3c3c3c3c3c3c3c3c3c3c3c3c3c3c3c3c3c3c3c3c3c3c3c3c"
}
