{
  "protocol_version": "codeattest.v0",
  "submission_outcome_id": "submission_outcome:synthetic-demo-0002",
  "review_id": "review:synthetic-demo-001",
  "outcome_state": "quarantined_no_receipt",
  "bundle_instance_id": "bundle_instance:synthetic-demo-0002",
  "submission_attempt_id": "submission_attempt:synthetic-demo-0002",
  "occurred_at": "2026-07-20T00:00:00Z",
  "submission_identities": [
    {
      "identity_type": "manifest_id",
      "identity_value": "sha256:1a1a1a1a1a1a1a1a1a1a1a1a1a1a1a1a1a1a1a1a1a1a1a1a1a1a1a1a1a1a1a1a"
    },
    {
      "identity_type": "evidence_bundle_id",
      "identity_value": "sha256:2b2b2b2b2b2b2b2b2b2b2b2b2b2b2b2b2b2b2b2b2b2b2b2b2b2b2b2b2b2b2b2b"
    },
    {
      "identity_type": "bundle_instance_id",
      "identity_value": "bundle_instance:synthetic-demo-0002"
    },
    {
      "identity_type": "submission_attempt_id",
      "identity_value": "submission_attempt:synthetic-demo-0002"
    }
  ],
  "failure_reason_codes": [
    "environment_gate_real_evidence_not_allowed"
  ],
  "next_path": "quarantine_support",
  "customer_facing_summary": "This submission was quarantined before any receipt was issued."
}
